corner_place_id,name,neighborhood,website,instagram_handle,timestamp,google_id,description,hours,category,price,reviews,rating
516,L'Industrie Pizzeria,Brooklyn,http://www.lindustriebk.com/,lindustriebk,2025-02-23T11:30:27.370618,ChIJQ-hJIuBbwokRRUdquw_5w5U,"Celebrated locale with covered outdoor seating, turning out classic old-world pies and slices, plus inventive flavor combinations.","{'Sunday': '12 to 10 PM', 'Monday': '12 to 10 PM', 'Tuesday': '12 to 10 PM', 'Wednesday': '12 to 10 PM', 'Thursday': '12 to 10 PM', 'Friday': '12 to 10 PM'}",Pizza restaurant,$10–20,"['I recently tried Industry Pizza in Brooklyn, and unfortunately, I wasn’t too impressed. I had heard a lot of good things about the place, so maybe I just happened to catch them on a bad day. For starters, the bathrooms were out of order, …', 'I was really impressed by the large number of people at the location and the long line for ordering. The atmosphere both inside and outside the store was fantastic! The staff were exceptionally nice, which made for a pleasant experience. …', 'The best pizza I’ve tried in New York and Brooklyn! Be aware that there can be long lines at certain times of the day, especially during peak meal hours. It’s almost impossible to eat inside, but there’s a quirky bus outside where you can enjoy your slices. The pizza is incredibly delicious and flavorful—definitely worth it!', 'Best slice in NYC on a recent trip to the city. Crust and dough was fantastic, a nice mix of NY and Napolitan pizza. Toppings were fresh, cooked to perfection. Friendly staff cool environment in the shop. Standing room only for dine in.', 'Came here at 12pm when they opened and there’s already a line but it did move quickly. Honestly, it’s the best pizza I’ve had in NY, I’ve tried slices from all the popular places like Mama Too’s, Joe’s and Bleeker st and this is the best. Pizza is cooked perfectly and not burnt underneath. A little pricey but well worth it.']",
11582,Double Chicken Please,Lower East Side,http://www.doublechickenplease.com/,doublechickenpleasenyc,2025-02-23T11:30:36.922939,ChIJI25hF09ZwokRnmmiXXONRf4,"Trendy, snug cocktail bar serving finger foods, chicken sandwiches & creative drinks.",,Bar,$50–100,"['I highly recommend Double Chicken Please, a standout bar that offers a unique and flavorful experience. One of the highlights for me was the salty egg chicken sandwich—it’s simply amazing! The flavors are rich and well-balanced, making it a …', 'Double Chicken Please NYC absolutely blew me away in the best possible way. I initially checked out the menu for their creative—and honestly, slightly bizarre-sounding—cocktails, and ended up going straight to “The Coop.” The entire …', 'Overall the food, ambiance, and service was really great! My friend and I did not do any research before coming here though and it was a confusing experience. We came on a weekday evening. When we got there we just put our name down and it …', 'Added my party of 2 to the waitlist at The Coop, when we went on the Valentine’s Day evening. Our table was ready 2 hours later. We really enjoyed the food, the mochi donut sandwich was incredible! I really enjoyed the salted egg yolk …', 'We loved it!\n\nDrinks were very delicious and extra innovative! We tried Japanese Cold Noodles, …']",
699,Thai Diner,Little Italy,http://www.thaidiner.com/,thaidiner,2025-02-23T11:30:46.583605,ChIJQyFr6-FZwokRr23JK7BC7_g,"Classic Thai dishes and drinks by a lauded restaurant group in a kitschy-cool, diner-style setting.",,Thai restaurant,$30–50,"['I recently made my second visit to Thai Diner, a restaurant situated on the edge of Little Italy, a somewhat unexpected location for a Thai establishment. Despite its location, the diner was busy with both patrons and staff. …', 'We visited Thai Diner on Mott Street and had to wait about an hour for a table, which was a bit disappointing. The Thai iced tea was refreshing and tasty, but the Tom Yum soup was far too sour and didn’t have the right balance of flavors. …', 'Man oh man where do I even start.. First of all if you plan to eat here on a weekend or even during business hours be prepared to wait! We didn’t have any reservations so we ended up having to wait around 1-1.5 hours for a table …', 'After hearing great things upon our arrival to NYC, we arrived right at opening on a Friday to guarantee ourselves a seat. The coolest interior, friendly staff and fantastic food. We shared the crispy rice eggs and French toast. I think next time I would try the pancakes instead, but still delicious.', 'Tried brunch with my girls here today and it was incredible. We shared the egg sandwich, fried eggs, and coconut pancakes. They were each unique and delicious, new take on brunch food I’ve never had before with thai basil and spices. Will definitely be back! Recommend going on a weekday to avoid the line']",
8772,Soothr,East Village,http://soothrnyc.com/,soothr_nyc,2025-02-23T11:30:55.289796,ChIJ0aS81yNZwokRIk-S2YSuvls,"Intimate space with al fresco dining, offering Thai noodles and soups, plus cocktails.","{'Sunday': '12 to 3:30 PM, 5 to 10 PM', 'Monday': '12 to 3:30 PM, 5 to 10 PM', 'Tuesday': '12 to 3:30 PM, 5 to 10 PM', 'Wednesday': '12 to 3:30 PM, 5 to 10 PM', 'Thursday': '12 to 3:30 PM, 5 to 10 PM', 'Friday': '12 to 3:30 PM, 5 to 11 PM'}",Thai restaurant,$30–50,"['The hype is real. This intimate place reminds me of my first time in Thailand. Yes because the food is delicious and flavorful, but mostly because of the friendliness and attentiveness of the staff. My waitress was amazing but it was my …', 'Our server was Nina and she was so friendly! She did a great job checking in on us and giving us recommendations. …', 'Firstly, the atmosphere was authentic and really brings the Thai culture. The food was nicely done but there was nothing WOW. I do love how they place lychee in the duck curry it really balances the flavour of sweet and savoury. The …', 'Easy to make reservations, friendly staffs. I highly recommend to ask for paper menu instead of QR code menu (so confusing). We were 5 people, order 2 appetizers and 5 entrees with 1 side dish. Everything was so good. I highly recommend the Tom Yum hot pot (decent size for sharing), and Chicken with Crispy noodles, also the Koong Curry!!', 'We had a wonderful dining experience! The food was delicious with generous portions, and our server, Nina, was outstanding. …']",
21236,Public Records,Brooklyn,http://publicrecords.nyc/,publicrecordsnyc,2025-02-23T11:31:04.371657,ChIJKb2SuKFbwokRyORCT_Xtf_s,Hi-fi record bar with food & drink offerings plus an intimate performance space & vegan cafe.,"{'Sunday': '10 AM to 9 PM', 'Monday': 'Closed', 'Tuesday': '10 AM to 5 PM', 'Wednesday': '10 AM to 10 PM', 'Thursday': '10 AM to 10 PM', 'Friday': '10 AM to 5 PM, 6 PM to 4 AM'}",Arts organization,,"['I rarely say this, especially while I’m still at the restaurant, but I will definitely be coming back — and I want to show this place to all my friends. It’s truly a fantastic spot! I loved every dish we tried. The staff was incredibly …', 'Public Records has a quirky layout that can be a bit confusing at first. For a recent music event, guests had to enter from a different entrance, check in at the back, and then head to the main venue at the front, with a small lounge …', 'Low key spot to NETWORK & VIBE.\n🙌🏼Great events almost every Wednesday🙌🏼And tickets could be purchased same day w/ coat check service available. …', 'enjoyed their cocktails and the dessert a lot for my birthday. the hostess was very sweet and the atmosphere was adorb - both in the dining room and in the garden with string lights on. can recommend tom in the afternoon (a light and smooth …', 'This place is undeniably charming, with a cozy and stylish atmosphere that immediately catches your eye. However, it’s quite small, and with the large number of people, it can feel a bit cramped at times. …']",
2698,Book Club Bar,Alphabet City,http://www.bookclubbar.com/,bookclubbar,2025-02-23T11:31:14.561518,ChIJwxHj5iBZwokR_pY9e5OhHNs,Cozy bookstore with comfy chairs for reading plus a bar serving handcrafted drinks.,"{'Sunday': '9 AM to 12 AM', 'Monday': '9 AM to 12 AM', 'Tuesday': '9 AM to 12 AM', 'Wednesday': '9 AM to 12 AM', 'Thursday': '9 AM to 1 AM', 'Friday': '9 AM to 1 AM'}",Book store,,"['Such a lovely place, there is even a garden. Amazing books, high quality in choice, I was really surprised. When I went to the restroom and I found out that they have put the Satrapi’s graphic novel on the walls I have said to myself I have …', 'The Galantine’s event yesterday was so lovely! I had the best time listening to authors I enjoy and the staff were amazing with the set up, the treats and the delicious drinks. Hope this becomes an annual tradition!', 'Immaculate. Especially during the holidays.\nTall person behind counter was extremely kind, even around midnight on a Saturday after was a probably a very long day. …', 'So much love for this space. It is so cute and what a great concept!! I was drawn here because this is where SMJ did her Crescent City 3 release. So cool!!', 'Wonderful place. Reasonably priced drinks and great coffee (for Manhattan). I sat there for three hours or so reading comic books. I prefer it over a regular bookstore but they typically don’t have the same selection. …']",
505,Win Son Bakery,Brooklyn,http://winsonbrooklyn.com/,,2025-02-23T11:31:24.845718,ChIJWUWEmp9bwokRD6Q20axkQoc,Laid-back neighborhood spot serving inventive twists on Taiwanese classics for brunch & dinner.,"{'Sunday': '9 AM to 9 PM', 'Monday': '9 AM to 3 PM', 'Tuesday': '9 AM to 9 PM', 'Wednesday': '9 AM to 9 PM', 'Thursday': '9 AM to 10 PM', 'Friday': '9 AM to 10 PM'}",Bakery,$10–20,"[""You need to get here ASAP! This place is on the top of my list for places you need to try in the city.  Scallion pancake BEC is UNREAL. My only complaint is they don't give you enough sauce to use it for every bite.  Mochi donut is perfect. …"", 'Enjoyed the Taiwanese inspired dishes! Jiucai Scallion Pancake tasted great and portion size was generous (could definitely be shared between 2 people) was very busy during lunch hours on a Saturday so prepared to dine at one of their standing tables.', 'SO GOOD OMG fusion Taiwanese gentrified breakfast but done rly well!! got the scallion bec, pork fan tuan, mochi donut and hot soy milk which came w some you tiao. Everything  was actually amazing, personal fav was the scallion bec and the …', 'Win Son Bakery totally lives up to its hype! They have an extensive menu with so many delicious options - from sweet to savory, you can’t go wrong ordering anything here. I went for a date caramel latte and egg and cheese on a scallion …', 'We had a bacon, egg, and cheese on a scallion pancake, a red rice donut, and a chocolate bolo bao. All the food was delicious, especially the egg sandwich with the tasty ginger deluxe sauce. It’s a bit hectic in there on a weekend morning …']",
503,La Cabra Bakery,East Village,https://us.lacabra.com/pages/east-village,lacabracoffee,2025-02-23T11:31:34.068461,ChIJT994RulZwokRdgqQX0zc3QY,"4.7
(1,144)
·$10–20","{'Sunday': '8 AM to 6 PM', 'Monday': '7 AM to 6 PM', 'Tuesday': '7 AM to 6 PM', 'Wednesday': '7 AM to 6 PM', 'Thursday': '7 AM to 6 PM', 'Friday': '7 AM to 6 PM'}",Coffee shop,$10–20,"['The croissant was perfection! Baked to the perfect point and the inside was perfectly spread.\nThe matcha was also pretty good. But the rest of the breads were a bit of …', 'A huge hit. Reminds me of Denmark SO much. Cardamom bun was perfect. Not too sweet, delicious pairing with coffee. …', 'Not that this spot needed another great review, but I just HAD to leave one because it’s truly that good! From start to finish, the service was exceptional—the staff was incredibly kind and welcoming, checking in on us and asking about our …', 'Absolutely loved my experience here! Great selection of freshly baked goods. Cardamom bun was so soft and delicious, as well as a perfect cup of cortado. Extremely friendly staff. Limited space, but i did not mind standing by their coffee bar. Will definitely come back.', 'A lovely selection of pour over, coffee beans, and pastries. The cardamom bun is always a standout; this time we tried the saffron bun, which had a subtler flavor while maintaining the beautiful twist and soft texture, an equally delightful treat!']",
1144,Misi,Brooklyn,http://www.misinewyork.com/,misinewyork,2025-02-23T11:31:43.468862,ChIJw7SsU_pZwokREyGSSulF53U,Contemporary-chic Italian dining space serving elevated antipasti and handmade pasta dishes.,"{'Sunday': '11:30 AM to 2:30 PM, 4:30 to 9:30 PM', 'Monday': '5 to 9:30 PM', 'Tuesday': '5 to 9:30 PM', 'Wednesday': '5 to 10:30 PM', 'Thursday': '5 to 9:30 PM', 'Friday': '11:30 AM to 2:30 PM, 4:30 to 9:30 PM'}",Italian restaurant,$50–100,"['The best pasta in New York! I often went there to go location near by to buy freshly made pasta and sauce, to cook at home. Cause this restaurant so hard to get the reservation, and luckily I finally got one. …', 'Misi - didn’t grab a reservation on a Sunday afternoon but we managed to squeeze in at the counter. For starters we had the trumpet mushroom and squash. Mushroom was really good. For pasta we had the tortellini and the nduja pasta. Pastas …', 'Definitely in my top 5 restaurants of Williamsburg, exceptional pastas, starters, ice cream\nVery good service! …', 'As fans of Lilia, my partner and I were super excited to try out Misi, and we were not disappointed! We had a lunch reservation on a Saturday afternoon. …', 'So glad I was finally able to try this place out. Firstly, the ambience and design of the restaurant is great. I love that you’re able to sit behind the counter (close to the kitchen). …']",
314,Raku,SoHo,http://rakunyc.com/,rakunyc,2025-02-23T11:31:52.642246,ChIJo3cQ0GxZwokRUukfD7IRfKk,"Busy, minimal-chic room offering house udon specialties and Japanese small plates.",,Udon noodle restaurant,$30–50,"['It was raining and freezing. But there were line waiting outside. Food is delicious. Atmosphere is nice. Employees are great. The only down side is the price. Understand it’s NYC and SOHO, but still highly overpriced. I would not visit again just for the price.', 'I ordered hot udon with shrimp. The noodles itself is quite amazing and comparable to origin japaness udon from Takamatsu. But the fried shrimp is not very crunchy. They gave frozen grape with the bill! Its delicious and brilliant idea 👍 …', 'We visited on a Saturday afternoon and had to wait about an hour for a table. We got two appetizers and one udon bowl which turned out to be too much for two hungry people. …', 'AMAZING food & service! We started with the sabazushi - mackerel was beautifully cooked & tender & there wasn’t any bad aftertaste. For the mains, we had hot udon & beef rice bowl - the noodles in the udon were absolute perfection & the …', 'recently visited Raku, and it was truly a memorable experience.\nThe udon noodles were freshly made, with the perfect chewy texture that made every bite enjoyable. The broth was rich and flavorful, striking a perfect balance …']",
3453,Eavesdrop,Greenpoint,https://www.eavesdrop.nyc/,,2025-02-23T11:32:22.090483,ChIJHdUJnfpZwokR96zcINvxiUU,"Trendy watering hole with specialty cocktails, creative bar bites & a sophisticated sound system.",,Bar,$$,"['Went early on a Sunday afternoon with no reservation, and they were able to seat three of us at the bar. The vibe was really chill, and their sound system is amazing. Great playlist to enjoy a snack and drink to. …', 'Absolute 10/10 experience with an amazing atmosphere. A great roster of DJs, delicious bar bites, and out-of-this-world drinks. The sound system here is incredible!', 'Very impeccable ambiance with great music selection and sound quality. Drinks are on the sweeter side and could be more well balanced, but the flavors are interesting', 'Found the curly haired bartender in my picture to be really anal and rude. We came here on a Monday night for a birthday with around 15 people, it wasn’t packed or crowded and this guy came over multiple times demanding we sit with no real …', 'Such a cool little vibe in Greenpoint! Didn’t have a reservation but they were able to accommodate me and a friend at the bar. The craft cocktails are super complex and thoughtfully made and everything we ordered was delicious. Highly …']",
8797,Café Lyria,NoHo,,cafelyria,2025-02-23T11:32:31.237740,ChIJcVcDbvVZwokRH9wq92JCQBo,"4.6
(411)
·$1–10","{'Sunday': '8 AM to 5 PM', 'Monday': '8 AM to 5 PM', 'Tuesday': '8 AM to 5 PM', 'Wednesday': '8 AM to 5 PM', 'Thursday': '8 AM to 5 PM', 'Friday': '8 AM to 5 PM'}",Cafe,$1–10,"['Lyria cafe is an awesome cafe with a modern vibe serving great coffee and pastries. The blueberry scone I got was a delight. The interior design and atmosphere were awesome, but we could not find a place to sit down. They had One Piece on the TV, which was pretty funny.', ""small coffee shop folded into the lobby of a NoHo building on a quiet stretch of Crosby Street. if it wasn't for tables and seats often scattered in front of Cafe Lyria, you'd likely walk by this spot and not notice it. the coffee shop …"", 'Super cute small coffee shop, and the lyria coffee was delicious. I don’t usually like coffee but i really liked this one. Grandmas cookie was also delicious though a bit on the small side.', 'The absolute best vibes. Groovy music, fun plants, great decorations, eccletic furniture, super kind staff and tasty drinks.', 'It’s only four stars because they didn’t do flavored lattes. There’s only like simple syrup on a side table for sweetener/flavors. I ended up ordering the only other recognizable item, which was an iced chai tea (latte?).There’s nothing to …']",
1152,Rule of Thirds,Greenpoint,http://thirdsbk.com/,thirdsbk,2025-02-23T11:32:40.422620,ChIJaQRXYuRZwokRHjAN5MkBizY,Creative Japanese comfort fare by a lauded restaurant group in a cozy setting with tall ceilings.,,Japanese restaurant,$50–100,"['Absolutely loved the setting and atmosphere at Rule of Thirds when we stopped in for dinner. The service was also exceptional, and we loved every dish and drink we ordered (which was most of the dinner menu!). There were four of us, and we …', 'Came here for dinner and loved both the wide variety of food but also the high quality. The duck rice was my favorite but a lot of the small plates including the mushrooms were very good. The space is beautiful and Service is very friendly. Would come back!', 'Rule of Thirds offered a phenomenal dining experience. Every single dish displayed the absolute love of food! Our favorite dishes (in no particular order) were the chicken katsu sando, the hottokeki, ajitama egg salad, and the roasted …', 'What a great place to try Japanese breaky!! Unique flavors my family and I loved, it was really refreshing to try something we’ve never tried before. The food was overall great! The atmosphere was simple and elegant, I enjoyed it. The …', 'I wrote this review on Yelp back in September but just wanted to share it here as well. We absolutely loved our experience at Rule of Thirds! Even prior to arriving, I had emailed them about some special requests about pre-ordering the food …']",
485,MONO+MONO,East Village,http://www.monomonony.com/,monomono.nyc,2025-02-23T11:32:49.646109,ChIJeYoRRYNZwokRMAtxzfUoRao,Korean fried chicken & other eats served alongside soju cocktails while DJs spin jazz records.,,Korean restaurant,$50–100,"['I strongly recommend the porridge! The flavoring is mild in the best way. You can simply enjoy the natural savoriness of the chicken, the sweetness of the vegetables and the brightness of the herbs. The ratio of chicken to rice was too …', 'The inside is beautifully decorated with the real tree and flower. The wall decorating with a lot of real book. We ordered the potato wedge, chicken wings and strip steak. …', 'Food and atmosphere were good. Drinks came out after entrees but were still tasty! Main issue we had was that we paid in big bills and the staff added all of our change as tip without telling us or offering any back. We sat at a cleared …', 'absolutely obsessed with the happy hour deals!!! had my birthday early dinner here and we got almost everything on the happy hour menu, which were all very delicious. the atmosphere and design are breathtaking and the staffs were all very friendly. would come back here over and over again x', 'Went with a group of friends and we all chose the tasting menu, there was more then enough for everyone + extra.\nThe Food is delicious especially the Korean Fried Chicken and Kimchi Rice.\nCan be Really cute date spot with all the flower decor and bar seating within the bookshelvs.']",
419,The Metropolitan Museum of Art,Manhattan,https://www.metmuseum.org/,metmuseum,2025-02-23T11:32:59.710965,ChIJb8Jg9pZYwokR-qHGtvSkLzs,"A grand setting for one of the world's greatest collections of art, from ancient to contemporary.",,Art museum,$$,"['The Met is seriously one of the coolest places I’ve ever been \U0001fa75✨🌼 The sheer size of it is mind-blowing, and there’s something for everyone—ancient mummies, stunning paintings, and even a full temple! You could spend hours (or days) here and …', ""It's one of the best museums I've ever visited: culture, history, rich exhibitions that make you travel not only through time but through continents: Egypt, Japan, China, India, Pakistan, Greece, Roman Empire, US, Europe - just wow! You can …"", 'The Met is such an incredible experience. It’s one of the biggest museums of any kind I’ve ever been to, and it’s packed from wall to wall with interesting stuff. Some sections are more interesting than others for me, but that’s all …', ""An absolute must see in New York! I've been visiting this museum for over 25 years now, and still feel that I've only explored a fraction of this wonderful museum. My all time favorites are the Temple of Dendur (in a snowy weather) and …"", 'My group and I visited the Flight into Egypt exhibit, and it was a wonderful experience. I truly enjoyed all the artwork on display. Unfortunately, the guys wanted to leave, so we didn’t stay long, but the time I did have there was amazing. We took the 6 train to 77th Street and walked to the museum.']",
121459,Bibliotheque,SoHo,https://www.bibliothequenyc.com/,bibliothequenyc,2025-02-23T11:33:08.821538,ChIJvTUD4LZZwokRPYqxLi7y9Kg,"4.3
(293)
·$$$","{'Sunday': '10 AM to 10 PM', 'Monday': '10 AM to 10 PM', 'Tuesday': '10 AM to 10 PM', 'Wednesday': '10 AM to 10 PM', 'Thursday': '10 AM to 10 PM', 'Friday': '10 AM to 11 PM'}",Wine bar,$$$,"['Adore this place!!! The tables inside are incredible. Foods are also great, go really well with their selection of wines. Definitely willing to go back with my friends. …', 'Lovely space! It has became my son’s favourite NYC hangout spot where he can read many books while enjoying delicious croissants and matcha latte, and I can enjoy some quiet reading time over nice coffee and orange wine. A good collection …', 'Bibliotheque: A Cozy Spot for Books, Bites, and Great Drinks\n\nIf you’re looking for a place that combines great food, drinks, and a love for …', 'Perfect spot to enjoy an elevated brew and your next read. They serve delicious beverages along with an assortment of fresh baked goods. I had a golden latte myself, and it was divine. In the back half of the cafe, they have an impressive …', 'I love this place! I came to relax and enjoy a coffee. The mocha and breakfast sandwich was perfect. I love the layout and ambience.  A great place to do a little work or read a book in the morning']",
2362,Devoción,Brooklyn,http://www.devocion.com/,devocionusa,2025-02-23T11:33:18.005993,ChIJi7flemFZwokRDpIJuxfOGek,"Carefully sourced Colombian coffee served in a light-filled, brick-lined space with leather sofas.","{'Sunday': '7:30 AM to 7 PM', 'Monday': '7:30 AM to 7 PM', 'Tuesday': '7:30 AM to 7 PM', 'Wednesday': '7:30 AM to 7 PM', 'Thursday': '7:30 AM to 7 PM', 'Friday': '7:30 AM to 7 PM'}",Coffee shop,$1–10,"['From the moment I walked into the store, the aroma of Colombian coffee was unmistakable—rich, unique, and truly incomparable. As always, I ordered a cappuccino and banana bread. The service was fast, efficient, and friendly, making the …', 'I absolutely love the atmosphere of this coffee shop.\nIt strikes a perfect balance between an industrial aesthetic and a fresh, inviting appearance. …', 'Great place for a coffee stop in Brooklyn!  When I was there the line was pretty long, but it moved fairly quickly.  I got an iced latte and some beans to go.  This isn’t the kind of place to get a super sugary coffee so if that’s what you …', 'Lovely place to enjoy freshly roasted coffee ☕️\nIt is amazing to see the roasting process at the entrance!\nThey also sell coffee bags, I would come here often! …', 'Saw this beautiful place from the outside and just had to stop by. The plants, the dark wood I mean this place was stunning. They didn’t offer and sweeteners for their coffee besides a simple syrup. Tea was amazing. So many options. Overall the place was beautiful.']",
